{
  "record_id": 4,
  "interview": {
    "month": "2023-10",
    "office": "foten"
  },
  "household": {
    "size": 1,
    "dependency_category": "low",
    "female_headed": null,
    "sole_carer": null,
    "spanish_spoken": true,
    "adult_illiteracy": false
  },
  "demographics": {
    "head_of_household": 1.0,
    "language_barrier": 1.0,
    "specific_needs": 1.0,
    "documentation": 1.0,
    "score": 0.0
  },
  "needs_and_coping": {
    "basic_needs": 1.776038647,
    "housing": 2.823478261,
    "negative_coping": 1.790108696,
    "dependency": 1.0,
    "score": 26.18890898
  },
  "scores": {
    "final_score": 25.34612370011462,
    "vulnerability_index": 2.730928248,
    "vulnerability_category": "Vulnerabilidad Moderada"
  },
  "administrative_flags": {
    "asylum_procedure": null,
    "intentions": 0,
    "duplicate": 0
  },
  "decision": {
    "eligibility_target": "INCLUSION",
    "eligibility_status": "Elegible",
    "rule": "No administrative flag on file and the vulnerability index clears the inclusion threshold."
  },
  "interview_analysis": "One-person household. Housing is the one serious gap: a shared room in an overcrowded building, rent in arrears, and heating only in the evening. Food is covered by the ration card. Identification and the asylum file were in order at the appointment and no documents are pending. No health or protection concerns raised, no interpreter needed, and the person answered questions directly. The household did not ask for anything beyond housing support."
}
