{
  "record_id": 324,
  "interview": {
    "month": "2023-07",
    "office": "foten"
  },
  "household": {
    "size": 4,
    "dependency_category": "average",
    "female_headed": false,
    "sole_carer": false,
    "spanish_spoken": false,
    "adult_illiteracy": true
  },
  "demographics": {
    "head_of_household": 1.0,
    "language_barrier": 1.0,
    "specific_needs": 1.0,
    "documentation": 1.0,
    "score": 0.0
  },
  "needs_and_coping": {
    "basic_needs": 1.0,
    "housing": 1.0,
    "negative_coping": 1.790108696,
    "dependency": 1.043888889,
    "score": 6.061858428
  },
  "scores": {
    "final_score": 5.866781761928531,
    "vulnerability_index": 2.169185496,
    "vulnerability_category": "Vulnerabilidad Baja"
  },
  "administrative_flags": {
    "asylum_procedure": null,
    "intentions": 0,
    "duplicate": 0
  },
  "decision": {
    "eligibility_target": "EXCLUSION",
    "eligibility_status": "No Elegible",
    "rule": "Every scorecard component is at its minimum and the vulnerability index stays below the inclusion threshold."
  },
  "interview_analysis": "Household of four, two adults and two children, arrived three months ago and moved twice since. They are currently in a converted garage shared with another family, without heating or running water. Neither adult speaks Spanish, only the children, and no interpreter was available, so the interview was conducted through the eldest child. One adult cannot read or write, so the forms were completed orally. There is no income at present: the father was looking for work when the workshop closed, and the mother cannot look for work while caring for the children alone. No immediate medical needs, but the youngest child has stopped attending school."
}
